{
  "$schema": "http://json-schema.org/draft-07/schema#",
  "$id": "gef-lexicon/language-realization.schema.json",
  "title": "Gef Topic Language Realization",
  "type": "object",
  "required": [
    "schema_version",
    "realization_id",
    "topic_id",
    "language_tag",
    "review_state",
    "version"
  ],
  "properties": {
    "schema_version": {"type": "integer", "const": 2},
    "realization_id": {"type": "string", "pattern": "^REAL\\.[A-Za-z0-9._-]+$"},
    "topic_id": {"type": "string", "pattern": "^TOPIC\\.[A-Za-z0-9._-]+$"},
    "language_tag": {"type": "string", "minLength": 1},
    "completeness": {
      "type": "string",
      "enum": ["draft", "complete"],
      "description": "`complete` means every required slot of the intro contract is filled (curriculum-v2/INTRO_FACTS.md) and the validator checks it; `draft` (the default) may carry nulls and missing facts, and coverage reports them."
    },
    "system_status": {
      "type": "string",
      "enum": ["present", "limited", "absent", "not_applicable", "unknown"]
    },
    "semantic_mappings": {
      "type": "array",
      "items": {"$ref": "#/definitions/semanticMapping"}
    },
    "construction_ids": {
      "type": "array",
      "items": {"type": "string", "pattern": "^CTR\\.[A-Za-z0-9._-]+$"},
      "uniqueItems": true
    },
    "focus_axis_values": {
      "type": "object",
      "additionalProperties": {"$ref": "#/definitions/factValue"}
    },
    "facts": {
      "type": "array",
      "items": {"$ref": "#/definitions/fact"}
    },
    "genealogy": {"$ref": "#/definitions/genealogy"},
    "capabilities": {"$ref": "#/definitions/capabilities"},
    "notes": {"type": "string"},
    "review_state": {"type": "string", "enum": ["candidate", "approved", "superseded", "rejected"]},
    "version": {"type": "integer", "minimum": 1}
  },
  "definitions": {
    "factValue": {
      "oneOf": [
        {"type": "string"},
        {"type": "number"},
        {"type": "boolean"},
        {"type": "array", "items": {"type": "string"}},
        {"type": "null"}
      ]
    },
    "fact": {
      "type": "object",
      "required": ["fact_id", "fact_kind", "value"],
      "properties": {
        "fact_id": {"type": "string", "minLength": 1},
        "fact_kind": {
          "type": "string",
          "enum": ["label", "term", "count", "boolean", "category", "relationship", "usage", "note"]
        },
        "value": {"$ref": "#/definitions/factValue"},
        "qualifiers": {
          "type": "object",
          "additionalProperties": {"$ref": "#/definitions/factValue"}
        }
      },
      "additionalProperties": false
    },
    "genealogy": {
      "type": "object",
      "properties": {
        "family_id": {"type": ["string", "null"]},
        "branch_ids": {"type": "array", "items": {"type": "string", "minLength": 1}},
        "ancestor_language_tags": {"type": "array", "items": {"type": "string", "minLength": 1}, "uniqueItems": true},
        "related_language_tags": {"type": "array", "items": {"type": "string", "minLength": 1}, "uniqueItems": true},
        "script_ids": {"type": "array", "items": {"type": "string", "minLength": 1}, "uniqueItems": true},
        "origin_region_ids": {"type": "array", "items": {"type": "string", "minLength": 1}, "uniqueItems": true},
        "notes": {"type": "string"}
      },
      "additionalProperties": false
    },
    "semanticMapping": {
      "type": "object",
      "required": ["semantic_function_id", "construction_ids"],
      "properties": {
        "semantic_function_id": {"type": "string", "pattern": "^SEM\\.[A-Z0-9._-]+$"},
        "construction_ids": {
          "type": "array",
          "items": {"type": "string", "pattern": "^CTR\\.[A-Za-z0-9._-]+$"},
          "uniqueItems": true
        },
        "conditions": {"type": "array", "items": {"type": "string", "minLength": 1}},
        "exclusions": {"type": "array", "items": {"type": "string", "minLength": 1}},
        "notes": {"type": "string"}
      },
      "additionalProperties": false
    },
    "capabilities": {
      "type": "object",
      "properties": {
        "explanation": {"type": "boolean"},
        "comparison": {"type": "boolean"},
        "reviewed_examples": {"type": "boolean"},
        "recognition_practice": {"type": "boolean"},
        "production_practice": {"type": "boolean"},
        "reading_transfer": {"type": "boolean"},
        "listening": {"type": "boolean"},
        "speaking": {"type": "boolean"},
        "story_quest": {"type": "boolean"}
      },
      "additionalProperties": false
    }
  },
  "additionalProperties": false
}
