{
  "schema_version": 2,
  "realization_id": "REAL.el.grammar_glance",
  "topic_id": "TOPIC.orientation.grammar_glance",
  "language_tag": "el",
  "completeness": "complete",
  "facts": [
    {
      "fact_id": "trait.noun_gender",
      "fact_kind": "category",
      "value": "three",
      "qualifiers": {"values": ["masculine", "feminine", "neuter"], "articles": ["ο", "η", "το"]}
    },
    {
      "fact_id": "trait.noun_gender.example.1",
      "fact_kind": "term",
      "value": "ο φίλος",
      "qualifiers": {"gender": "masculine"}
    },
    {
      "fact_id": "trait.noun_gender.example.2",
      "fact_kind": "term",
      "value": "η γάτα",
      "qualifiers": {"gender": "feminine"}
    },
    {
      "fact_id": "trait.noun_gender.example.3",
      "fact_kind": "term",
      "value": "το βιβλίο",
      "qualifiers": {"gender": "neuter"}
    },
    {"fact_id": "trait.articles", "fact_kind": "category", "value": "definite_indefinite"},
    {"fact_id": "trait.articles.example.1", "fact_kind": "term", "value": "ο σκύλος, ένας σκύλος"},
    {
      "fact_id": "trait.formal_you",
      "fact_kind": "category",
      "value": "distinct",
      "qualifiers": {"informal": "εσύ", "formal": "εσείς"}
    },
    {
      "fact_id": "trait.formal_you.example.1",
      "fact_kind": "term",
      "value": "Τι κάνεις;",
      "qualifiers": {"register": "informal"}
    },
    {
      "fact_id": "trait.formal_you.example.2",
      "fact_kind": "term",
      "value": "Τι κάνετε;",
      "qualifiers": {"register": "formal"}
    },
    {
      "fact_id": "trait.verb_endings",
      "fact_kind": "category",
      "value": "many",
      "qualifiers": {"example_verb": "μιλάω"}
    },
    {
      "fact_id": "trait.verb_endings.example.1",
      "fact_kind": "term",
      "value": "μιλάω / μιλάς / μιλάει / μιλάμε / μιλάτε / μιλάνε"
    },
    {"fact_id": "trait.subject_pronouns", "fact_kind": "category", "value": "often_dropped"},
    {"fact_id": "trait.subject_pronouns.example.1", "fact_kind": "term", "value": "Μιλάω ελληνικά."},
    {"fact_id": "trait.adjective_position", "fact_kind": "category", "value": "before_noun"},
    {"fact_id": "trait.adjective_position.example.1", "fact_kind": "term", "value": "ένα μεγάλο σπίτι"},
    {
      "fact_id": "trait.cases",
      "fact_kind": "category",
      "value": "some",
      "qualifiers": {"count": 4}
    },
    {"fact_id": "trait.cases.example.1", "fact_kind": "term", "value": "ο φίλος / του φίλου / τον φίλο"},
    {"fact_id": "trait.word_order", "fact_kind": "category", "value": "flexible"},
    {"fact_id": "trait.word_order.example.1", "fact_kind": "term", "value": "Διαβάζει ένα βιβλίο η Μαρία."},
    {"fact_id": "trait.questions", "fact_kind": "category", "value": "intonation_or_inversion"},
    {"fact_id": "trait.questions.example.1", "fact_kind": "term", "value": "Μιλάς ελληνικά;"},
    {"fact_id": "trait.word_building", "fact_kind": "category", "value": "inflecting"},
    {"fact_id": "trait.word_building.example.1", "fact_kind": "term", "value": "μιλάμε"},
    {"fact_id": "trait.classifiers", "fact_kind": "category", "value": "none"},
    {"fact_id": "trait.dual_number", "fact_kind": "category", "value": "none"},
    {
      "fact_id": "noun.1",
      "fact_kind": "term",
      "value": "φίλος",
      "qualifiers": {"article": "ο", "gender": "masculine"}
    },
    {
      "fact_id": "noun.2",
      "fact_kind": "term",
      "value": "γάτα",
      "qualifiers": {"article": "η", "gender": "feminine"}
    },
    {
      "fact_id": "noun.3",
      "fact_kind": "term",
      "value": "βιβλίο",
      "qualifiers": {"article": "το", "gender": "neuter"}
    },
    {
      "fact_id": "noun.4",
      "fact_kind": "term",
      "value": "σπίτι",
      "qualifiers": {"article": "το", "gender": "neuter"}
    },
    {
      "fact_id": "noun.5",
      "fact_kind": "term",
      "value": "πόλη",
      "qualifiers": {"article": "η", "gender": "feminine"}
    },
    {
      "fact_id": "noun.6",
      "fact_kind": "term",
      "value": "ήλιος",
      "qualifiers": {"article": "ο", "gender": "masculine"}
    }
  ],
  "capabilities": {"explanation": true, "comparison": true, "reviewed_examples": true, "recognition_practice": true},
  "review_state": "candidate",
  "version": 1
}
