{
  "schema_version": 2,
  "realization_id": "REAL.it.language_overview",
  "topic_id": "TOPIC.orientation.language_overview",
  "language_tag": "it",
  "completeness": "complete",
  "genealogy": {
    "family_id": "indo_european",
    "branch_ids": ["italic", "romance"],
    "ancestor_language_tags": ["la"],
    "related_language_tags": ["es", "fr", "pt", "ro"],
    "script_ids": ["Latn"],
    "origin_region_ids": ["europe"],
    "notes": "Broad historical-family metadata for orientation only; Romance membership does not imply modern mutual intelligibility."
  },
  "facts": [
    {"fact_id": "reach.regions", "fact_kind": "category", "value": ["europe"]},
    {"fact_id": "hook.target", "fact_kind": "term", "value": "ciao"},
    {"fact_id": "hook.decoy.1", "fact_kind": "term", "value": "grazie"},
    {"fact_id": "hook.decoy.2", "fact_kind": "term", "value": "scusi"}
  ],
  "capabilities": {"explanation": true, "comparison": true, "recognition_practice": true},
  "review_state": "candidate",
  "version": 3
}
