{
  "schema_version": 2,
  "realization_id": "REAL.pt.writing_system",
  "topic_id": "TOPIC.orientation.writing_system",
  "language_tag": "pt",
  "facts": [
    {"fact_id": "script.id", "fact_kind": "category", "value": "Latn"},
    {"fact_id": "script.direction", "fact_kind": "category", "value": "ltr"},
    {"fact_id": "script.has_case", "fact_kind": "boolean", "value": true},
    {
      "fact_id": "alphabet.letters",
      "fact_kind": "term",
      "value": ["a", "b", "c", "d", "e", "f", "g", "h", "i", "j", "k", "l", "m", "n", "o", "p", "q", "r", "s", "t", "u", "v", "w", "x", "y", "z"]
    },
    {
      "fact_id": "alphabet.marked",
      "fact_kind": "term",
      "value": ["á", "â", "ã", "à", "é", "ê", "í", "ó", "ô", "õ", "ú", "ç"]
    },
    {"fact_id": "punctuation.special", "fact_kind": "term", "value": []},
    {
      "fact_id": "mark.acute",
      "fact_kind": "term",
      "value": "é",
      "qualifiers": {"mark_id": "acute", "role": "stress", "example": "café", "example_ipa": "kaˈfɛ"}
    },
    {
      "fact_id": "mark.circumflex",
      "fact_kind": "term",
      "value": "ê",
      "qualifiers": {"mark_id": "circumflex", "role": "vowel_quality", "example": "você", "example_ipa": "voˈse"}
    },
    {
      "fact_id": "mark.tilde",
      "fact_kind": "term",
      "value": "ã",
      "qualifiers": {"mark_id": "tilde", "role": "sound_change", "example": "pão", "example_ipa": "ˈpɐ̃w̃"}
    },
    {
      "fact_id": "mark.cedilla",
      "fact_kind": "term",
      "value": "ç",
      "qualifiers": {"mark_id": "cedilla", "role": "sound_change", "example": "açúcar", "example_ipa": "aˈsukɐʁ"}
    }
  ],
  "capabilities": {"explanation": true, "reviewed_examples": true, "recognition_practice": true},
  "review_state": "candidate",
  "version": 1
}
